15:31:14.433279 IP (tos 0x68, ttl 51, id 38646, offset 0, flags [DF], proto TCP (6), length 1476)
    20.207.73.82.https > 192.168.0.108.38194: Flags [.], cksum 0xbb34 (correct), seq 3483707586:3483709010, ack 1544056597, win 69, options [nop,nop,TS val 2290131759 ecr 1910654205], length 1424
15:31:14.433395 IP (tos 0x0, ttl 64, id 50434, offset 0, flags [DF], proto TCP (6), length 64)
    192.168.0.108.38194 > 20.207.73.82.https: Flags [.], cksum 0xda83 (correct), seq 1, ack 4294965872, win 3325, options [nop,nop,TS val 1910657306 ecr 2290131759,nop,nop,sack 1 {0:1424}], length 0
15:31:14.433446 IP (tos 0x68, ttl 51, id 38647, offset 0, flags [DF], proto TCP (6), length 1476)
    20.207.73.82.https > 192.168.0.108.38194: Flags [P.], cksum 0x5010 (correct), seq 1424:2848, ack 1, win 69, options [nop,nop,TS val 2290131759 ecr 1910654205], length 1424
15:31:14.433476 IP (tos 0x0, ttl 64, id 50435, offset 0, flags [DF], proto TCP (6), length 64)
    192.168.0.108.38194 > 20.207.73.82.https: Flags [.], cksum 0xd4f3 (correct), seq 1, ack 4294965872, win 3325, options [nop,nop,TS val 1910657306 ecr 2290131759,nop,nop,sack 1 {0:2848}], length 0
15:31:14.460672 IP (tos 0x68, ttl 51, id 38648, offset 0, flags [DF], proto TCP (6), length 1476)
    20.207.73.82.https > 192.168.0.108.38194: Flags [.], cksum 0xab1b (correct), seq 2848:4272, ack 1, win 69, options [nop,nop,TS val 2290131759 ecr 1910654205], length 1424
15:31:14.460782 IP (tos 0x0, ttl 64, id 50436, offset 0, flags [DF], proto TCP (6), length 64)
    192.168.0.108.38194 > 20.207.73.82.https: Flags [.], cksum 0xcf48 (correct), seq 1, ack 4294965872, win 3325, options [nop,nop,TS val 1910657333 ecr 2290131759,nop,nop,sack 1 {0:4272}], length 0
15:31:14.524177 IP (tos 0x68, ttl 51, id 38649, offset 0, flags [DF], proto TCP (6), length 1476)
    20.207.73.82.https > 192.168.0.108.38194: Flags [.], cksum 0x3636 (correct), seq 4272:5696, ack 1, win 69, options [nop,nop,TS val 2290131759 ecr 1910654205], length 1424
15:31:14.524295 IP (tos 0x0, ttl 64, id 50437, offset 0, flags [DF], proto TCP (6), length 64)
    192.168.0.108.38194 > 20.207.73.82.https: Flags [.], cksum 0xc978 (correct), seq 1, ack 4294965872, win 3325, options [nop,nop,TS val 1910657397 ecr 2290131759,nop,nop,sack 1 {0:5696}], length 0
15:31:14.649291 IP (tos 0x68, ttl 51, id 38650, offset 0, flags [DF], proto TCP (6), length 1476)
    20.207.73.82.https > 192.168.0.108.38194: Flags [P.], cksum 0x1fda (correct), seq 5696:7120, ack 1, win 69, options [nop,nop,TS val 2290131759 ecr 1910654205], length 1424
15:31:14.649405 IP (tos 0x0, ttl 64, id 50438, offset 0, flags [DF], proto TCP (6), length 64)
    192.168.0.108.38194 > 20.207.73.82.https: Flags [.], cksum 0xc36b (correct), seq 1, ack 4294965872, win 3325, options [nop,nop,TS val 1910657522 ecr 2290131759,nop,nop,sack 1 {0:7120}], length 0
15:31:14.700593 IP (tos 0x68, ttl 51, id 38651, offset 0, flags [DF], proto TCP (6), length 1476)
    20.207.73.82.https > 192.168.0.108.38194: Flags [.], cksum 0x8ef7 (correct), seq 7120:8544, ack 1, win 69, options [nop,nop,TS val 2290131759 ecr 1910654205], length 1424
15:31:14.700700 IP (tos 0x0, ttl 64, id 50439, offset 0, flags [DF], proto TCP (6), length 64)
    192.168.0.108.38194 > 20.207.73.82.https: Flags [.], cksum 0xbda8 (correct), seq 1, ack 4294965872, win 3325, options [nop,nop,TS val 1910657573 ecr 2290131759,nop,nop,sack 1 {0:8544}], length 0
15:31:14.741011 IP (tos 0x68, ttl 51, id 38652, offset 0, flags [DF], proto TCP (6), length 1476)
    20.207.73.82.https > 192.168.0.108.38194: Flags [P.], cksum 0xc6f3 (correct), seq 8544:9968, ack 1, win 69, options [nop,nop,TS val 2290131759 ecr 1910654205], length 1424
15:31:14.741125 IP (tos 0x0, ttl 64, id 50440, offset 0, flags [DF], proto TCP (6), length 64)
    192.168.0.108.38194 > 20.207.73.82.https: Flags [.], cksum 0xb7f0 (correct), seq 1, ack 4294965872, win 3325, options [nop,nop,TS val 1910657613 ecr 2290131759,nop,nop,sack 1 {0:9968}], length 0
15:31:14.779027 IP (tos 0x68, ttl 51, id 38653, offset 0, flags [DF], proto TCP (6), length 1476)
    20.207.73.82.https > 192.168.0.108.38194: Flags [.], cksum 0x9436 (correct), seq 9968:11392, ack 1, win 69, options [nop,nop,TS val 2290131759 ecr 1910654205], length 1424
15:31:14.779134 IP (tos 0x0, ttl 64, id 50441, offset 0, flags [DF], proto TCP (6), length 64)
    192.168.0.108.38194 > 20.207.73.82.https: Flags [.], cksum 0xb23a (correct), seq 1, ack 4294965872, win 3325, options [nop,nop,TS val 1910657651 ecr 2290131759,nop,nop,sack 1 {0:11392}], length 0
15:31:14.891189 IP (tos 0x68, ttl 51, id 38654, offset 0, flags [DF], proto TCP (6), length 1476)
    20.207.73.82.https > 192.168.0.108.38194: Flags [P.], cksum 0x5bb2 (correct), seq 11392:12816, ack 1, win 69, options [nop,nop,TS val 2290131759 ecr 1910654205], length 1424
15:31:14.892469 IP (tos 0x0, ttl 64, id 50442, offset 0, flags [DF], proto TCP (6), length 64)
    192.168.0.108.38194 > 20.207.73.82.https: Flags [.], cksum 0xac39 (correct), seq 1, ack 4294965872, win 3325, options [nop,nop,TS val 1910657764 ecr 2290131759,nop,nop,sack 1 {0:12816}], length 0
15:31:14.929998 IP (tos 0x68, ttl 51, id 38655, offset 0, flags [DF], proto TCP (6), length 1476)
    20.207.73.82.https > 192.168.0.108.38194: Flags [.], cksum 0x5dbb (correct), seq 12816:14240, ack 1, win 69, options [nop,nop,TS val 2290131759 ecr 1910654205], length 1424
15:31:14.931277 IP (tos 0x0, ttl 64, id 50443, offset 0, flags [DF], proto TCP (6), length 64)
    192.168.0.108.38194 > 20.207.73.82.https: Flags [.], cksum 0xa683 (correct), seq 1, ack 4294965872, win 3325, options [nop,nop,TS val 1910657802 ecr 2290131759,nop,nop,sack 1 {0:14240}], length 0
15:31:15.296481 IP (tos 0x68, ttl 51, id 38656, offset 0, flags [DF], proto TCP (6), length 1476)
    20.207.73.82.https > 192.168.0.108.38194: Flags [P.], cksum 0x1a51 (correct), seq 14240:15664, ack 1, win 69, options [nop,nop,TS val 2290131759 ecr 1910654205], length 1424
15:31:15.297691 IP (tos 0x0, ttl 64, id 50444, offset 0, flags [DF], proto TCP (6), length 64)
    192.168.0.108.38194 > 20.207.73.82.https: Flags [.], cksum 0x9f84 (correct), seq 1, ack 4294965872, win 3325, options [nop,nop,TS val 1910658169 ecr 2290131759,nop,nop,sack 1 {0:15664}], length 0
15:31:15.309438 IP (tos 0x68, ttl 51, id 38657, offset 0, flags [DF], proto TCP (6), length 1476)
    20.207.73.82.https > 192.168.0.108.38194: Flags [.], cksum 0x3100 (correct), seq 15664:17088, ack 1, win 69, options [nop,nop,TS val 2290131759 ecr 1910654205], length 1424
15:31:15.310724 IP (tos 0x0, ttl 64, id 50445, offset 0, flags [DF], proto TCP (6), length 64)
    192.168.0.108.38194 > 20.207.73.82.https: Flags [.], cksum 0x99e7 (correct), seq 1, ack 4294965872, win 3325, options [nop,nop,TS val 1910658182 ecr 2290131759,nop,nop,sack 1 {0:17088}], length 0
15:31:15.335052 IP (tos 0x68, ttl 51, id 38658, offset 0, flags [DF], proto TCP (6), length 1476)
    20.207.73.82.https > 192.168.0.108.38194: Flags [P.], cksum 0xf4d4 (correct), seq 17088:18512, ack 1, win 69, options [nop,nop,TS val 2290131759 ecr 1910654205], length 1424
15:31:15.336324 IP (tos 0x0, ttl 64, id 50446, offset 0, flags [DF], proto TCP (6), length 64)
    192.168.0.108.38194 > 20.207.73.82.https: Flags [.], cksum 0x943e (correct), seq 1, ack 4294965872, win 3325, options [nop,nop,TS val 1910658207 ecr 2290131759,nop,nop,sack 1 {0:18512}], length 0
15:31:15.363060 IP (tos 0x68, ttl 51, id 38659, offset 0, flags [DF], proto TCP (6), length 1476)
    20.207.73.82.https > 192.168.0.108.38194: Flags [.], cksum 0x8fab (correct), seq 18512:19936, ack 1, win 69, options [nop,nop,TS val 2290131759 ecr 1910654205], length 1424
15:31:15.364338 IP (tos 0x0, ttl 64, id 50447, offset 0, flags [DF], proto TCP (6), length 64)
    192.168.0.108.38194 > 20.207.73.82.https: Flags [.], cksum 0x8e92 (correct), seq 1, ack 4294965872, win 3325, options [nop,nop,TS val 1910658235 ecr 2290131759,nop,nop,sack 1 {0:19936}], length 0
15:31:15.389159 IP (tos 0x68, ttl 51, id 38660, offset 0, flags [DF], proto TCP (6), length 1476)
    20.207.73.82.https > 192.168.0.108.38194: Flags [P.], cksum 0xe6b5 (correct), seq 19936:21360, ack 1, win 69, options [nop,nop,TS val 2290131759 ecr 1910654205], length 1424
15:31:15.390393 IP (tos 0x0, ttl 64, id 50448, offset 0, flags [DF], proto TCP (6), length 64)
    192.168.0.108.38194 > 20.207.73.82.https: Flags [.], cksum 0x88e7 (correct), seq 1, ack 4294965872, win 3325, options [nop,nop,TS val 1910658262 ecr 2290131759,nop,nop,sack 1 {0:21360}], length 0
15:31:15.401946 IP (tos 0x68, ttl 51, id 38661, offset 0, flags [DF], proto TCP (6), length 1476)
    20.207.73.82.https > 192.168.0.108.38194: Flags [.], cksum 0xfe00 (correct), seq 21360:22784, ack 1, win 69, options [nop,nop,TS val 2290131759 ecr 1910654205], length 1424
15:31:15.403202 IP (tos 0x0, ttl 64, id 50449, offset 0, flags [DF], proto TCP (6), length 64)
    192.168.0.108.38194 > 20.207.73.82.https: Flags [.], cksum 0x834b (correct), seq 1, ack 4294965872, win 3325, options [nop,nop,TS val 1910658274 ecr 2290131759,nop,nop,sack 1 {0:22784}], length 0
15:31:15.427333 IP (tos 0x68, ttl 51, id 38662, offset 0, flags [DF], proto TCP (6), length 1476)
    20.207.73.82.https > 192.168.0.108.38194: Flags [P.], cksum 0xef6c (correct), seq 22784:24208, ack 1, win 69, options [nop,nop,TS val 2290131759 ecr 1910654205], length 1424
15:31:15.428610 IP (tos 0x0, ttl 64, id 50450, offset 0, flags [DF], proto TCP (6), length 64)
    192.168.0.108.38194 > 20.207.73.82.https: Flags [.], cksum 0x7da1 (correct), seq 1, ack 4294965872, win 3325, options [nop,nop,TS val 1910658300 ecr 2290131759,nop,nop,sack 1 {0:24208}], length 0
15:31:15.440221 IP (tos 0x68, ttl 51, id 38663, offset 0, flags [DF], proto TCP (6), length 1476)
    20.207.73.82.https > 192.168.0.108.38194: Flags [.], cksum 0x5d4a (correct), seq 24208:25632, ack 1, win 69, options [nop,nop,TS val 2290131759 ecr 1910654205], length 1424
15:31:15.441497 IP (tos 0x0, ttl 64, id 50451, offset 0, flags [DF], proto TCP (6), length 64)
    192.168.0.108.38194 > 20.207.73.82.https: Flags [.], cksum 0x7804 (correct), seq 1, ack 4294965872, win 3325, options [nop,nop,TS val 1910658313 ecr 2290131759,nop,nop,sack 1 {0:25632}], length 0
15:31:15.467904 IP (tos 0x68, ttl 51, id 38664, offset 0, flags [DF], proto TCP (6), length 1476)
    20.207.73.82.https > 192.168.0.108.38194: Flags [.], cksum 0xa95c (correct), seq 25632:27056, ack 1, win 69, options [nop,nop,TS val 2290131786 ecr 1910654244], length 1424
15:31:15.469179 IP (tos 0x0, ttl 64, id 50452, offset 0, flags [DF], proto TCP (6), length 64)
    192.168.0.108.38194 > 20.207.73.82.https: Flags [.], cksum 0x7259 (correct), seq 1, ack 4294965872, win 3325, options [nop,nop,TS val 1910658340 ecr 2290131759,nop,nop,sack 1 {0:27056}], length 0
15:31:15.482560 IP (tos 0x68, ttl 51, id 38665, offset 0, flags [DF], proto TCP (6), length 1476)
    20.207.73.82.https > 192.168.0.108.38194: Flags [P.], cksum 0xd789 (correct), seq 27056:28480, ack 1, win 69, options [nop,nop,TS val 2290131786 ecr 1910654244], length 1424
15:31:15.483826 IP (tos 0x0, ttl 64, id 50453, offset 0, flags [DF], proto TCP (6), length 64)
    192.168.0.108.38194 > 20.207.73.82.https: Flags [.], cksum 0x6cba (correct), seq 1, ack 4294965872, win 3325, options [nop,nop,TS val 1910658355 ecr 2290131759,nop,nop,sack 1 {0:28480}], length 0
15:31:15.508188 IP (tos 0x68, ttl 51, id 38666, offset 0, flags [DF], proto TCP (6), length 1476)
    20.207.73.82.https > 192.168.0.108.38194: Flags [.], cksum 0xe93e (correct), seq 28480:29904, ack 1, win 69, options [nop,nop,TS val 2290131880 ecr 1910654321], length 1424
15:31:15.509465 IP (tos 0x0, ttl 64, id 50454, offset 0, flags [DF], proto TCP (6), length 64)
    192.168.0.108.38194 > 20.207.73.82.https: Flags [.], cksum 0x6710 (correct), seq 1, ack 4294965872, win 3325, options [nop,nop,TS val 1910658381 ecr 2290131759,nop,nop,sack 1 {0:29904}], length 0
15:31:15.520969 IP (tos 0x68, ttl 51, id 38667, offset 0, flags [DF], proto TCP (6), length 1476)
    20.207.73.82.https > 192.168.0.108.38194: Flags [P.], cksum 0x6468 (correct), seq 29904:31328, ack 1, win 69, options [nop,nop,TS val 2290131880 ecr 1910654321], length 1424
15:31:15.522250 IP (tos 0x0, ttl 64, id 50455, offset 0, flags [DF], proto TCP (6), length 64)
    192.168.0.108.38194 > 20.207.73.82.https: Flags [.], cksum 0x6174 (correct), seq 1, ack 4294965872, win 3325, options [nop,nop,TS val 1910658393 ecr 2290131759,nop,nop,sack 1 {0:31328}], length 0
15:31:15.533823 IP (tos 0x68, ttl 51, id 38668, offset 0, flags [DF], proto TCP (6), length 1476)
    20.207.73.82.https > 192.168.0.108.38194: Flags [.], cksum 0xaa59 (correct), seq 31328:32752, ack 1, win 69, options [nop,nop,TS val 2290131880 ecr 1910654321], length 1424
15:31:15.535097 IP (tos 0x0, ttl 64, id 50456, offset 0, flags [DF], proto TCP (6), length 64)
    192.168.0.108.38194 > 20.207.73.82.https: Flags [.], cksum 0x5bd7 (correct), seq 1, ack 4294965872, win 3325, options [nop,nop,TS val 1910658406 ecr 2290131759,nop,nop,sack 1 {0:32752}], length 0
15:31:15.546673 IP (tos 0x68, ttl 51, id 38669, offset 0, flags [DF], proto TCP (6), length 1476)
    20.207.73.82.https > 192.168.0.108.38194: Flags [.], cksum 0xe18b (correct), seq 32752:34176, ack 1, win 69, options [nop,nop,TS val 2290132199 ecr 1910654376], length 1424
15:31:15.547955 IP (tos 0x0, ttl 64, id 50457, offset 0, flags [DF], proto TCP (6), length 64)
    192.168.0.108.38194 > 20.207.73.82.https: Flags [.], cksum 0x563a (correct), seq 1, ack 4294965872, win 3325, options [nop,nop,TS val 1910658419 ecr 2290131759,nop,nop,sack 1 {0:34176}], length 0
15:31:15.603827 IP (tos 0x68, ttl 51, id 38670, offset 0, flags [DF], proto TCP (6), length 1476)
    20.207.73.82.https > 192.168.0.108.38194: Flags [P.], cksum 0x8f05 (correct), seq 34176:35600, ack 1, win 69, options [nop,nop,TS val 2290132199 ecr 1910654376], length 1424
15:31:15.605093 IP (tos 0x0, ttl 64, id 50458, offset 0, flags [DF], proto TCP (6), length 64)
    192.168.0.108.38194 > 20.207.73.82.https: Flags [.], cksum 0x5071 (correct), seq 1, ack 4294965872, win 3325, options [nop,nop,TS val 1910658476 ecr 2290131759,nop,nop,sack 1 {0:35600}], length 0
15:31:15.616681 IP (tos 0x68, ttl 51, id 38671, offset 0, flags [DF], proto TCP (6), length 1476)
    20.207.73.82.https > 192.168.0.108.38194: Flags [.], cksum 0xea5f (correct), seq 35600:37024, ack 1, win 69, options [nop,nop,TS val 2290132318 ecr 1910654414], length 1424
15:31:15.617957 IP (tos 0x0, ttl 64, id 50459, offset 0, flags [DF], proto TCP (6), length 64)
    192.168.0.108.38194 > 20.207.73.82.https: Flags [.], cksum 0x4ad4 (correct), seq 1, ack 4294965872, win 3325, options [nop,nop,TS val 1910658489 ecr 2290131759,nop,nop,sack 1 {0:37024}], length 0
15:31:15.629479 IP (tos 0x68, ttl 51, id 38672, offset 0, flags [DF], proto TCP (6), length 1476)
    20.207.73.82.https > 192.168.0.108.38194: Flags [P.], cksum 0xe93d (correct), seq 37024:38448, ack 1, win 69, options [nop,nop,TS val 2290132318 ecr 1910654414], length 1424
15:31:15.630755 IP (tos 0x0, ttl 64, id 50460, offset 0, flags [DF], proto TCP (6), length 64)
    192.168.0.108.38194 > 20.207.73.82.https: Flags [.], cksum 0x4537 (correct), seq 1, ack 4294965872, win 3325, options [nop,nop,TS val 1910658502 ecr 2290131759,nop,nop,sack 1 {0:38448}], length 0
15:31:15.642307 IP (tos 0x68, ttl 51, id 38673, offset 0, flags [DF], proto TCP (6), length 1476)
    20.207.73.82.https > 192.168.0.108.38194: Flags [.], cksum 0x8aa0 (correct), seq 38448:39872, ack 1, win 69, options [nop,nop,TS val 2290132318 ecr 1910654414], length 1424
15:31:15.643584 IP (tos 0x0, ttl 64, id 50461, offset 0, flags [DF], proto TCP (6), length 64)
    192.168.0.108.38194 > 20.207.73.82.https: Flags [.], cksum 0x3f9a (correct), seq 1, ack 4294965872, win 3325, options [nop,nop,TS val 1910658515 ecr 2290131759,nop,nop,sack 1 {0:39872}], length 0
15:31:15.652294 IP (tos 0x68, ttl 51, id 38674, offset 0, flags [DF], proto TCP (6), length 827)
    20.207.73.82.https > 192.168.0.108.38194: Flags [P.], cksum 0xca1a (correct), seq 39872:40647, ack 1, win 69, options [nop,nop,TS val 2290132318 ecr 1910654414], length 775
15:31:15.653575 IP (tos 0x0, ttl 64, id 50462, offset 0, flags [DF], proto TCP (6), length 64)
    192.168.0.108.38194 > 20.207.73.82.https: Flags [.], cksum 0x3c89 (correct), seq 1, ack 4294965872, win 3325, options [nop,nop,TS val 1910658525 ecr 2290131759,nop,nop,sack 1 {0:40647}], length 0
15:31:15.661572 IP (tos 0x68, ttl 51, id 38675, offset 0, flags [DF], proto TCP (6), length 827)
    20.207.73.82.https > 192.168.0.108.38194: Flags [P.], cksum 0xc410 (correct), seq 39872:40647, ack 1, win 69, options [nop,nop,TS val 2290133771 ecr 1910654507], length 775
15:31:15.662850 IP (tos 0x0, ttl 64, id 50463, offset 0, flags [DF], proto TCP (6), length 72)
    192.168.0.108.38194 > 20.207.73.82.https: Flags [.], cksum 0xf117 (correct), seq 1, ack 4294965872, win 3325, options [nop,nop,TS val 1910658534 ecr 2290131759,nop,nop,sack 2 {39872:40647}{0:40647}], length 0
15:31:15.662979 IP (tos 0x68, ttl 51, id 38676, offset 0, flags [DF], proto TCP (6), length 52)
    20.207.73.82.https > 192.168.0.108.38194: Flags [.], cksum 0x68b6 (correct), seq 40647, ack 1, win 69, options [nop,nop,TS val 2290135266 ecr 1910655500], length 0
15:31:15.699348 IP (tos 0x0, ttl 64, id 51707, offset 0, flags [DF], proto TCP (6), length 60)
    192.168.0.108.38350 > bom12s15-in-f3.1e100.net.https: Flags [S], cksum 0x5f68 (correct), seq 2955533157, win 32120, options [mss 1460,sackOK,TS val 689114817 ecr 0,nop,wscale 7], length 0
15:31:15.716276 IP (tos 0x28, ttl 60, id 0, offset 0, flags [DF], proto TCP (6), length 60)
    bom12s15-in-f3.1e100.net.https > 192.168.0.108.38350: Flags [S.], cksum 0x58f5 (correct), seq 778623647, ack 2955533158, win 65535, options [mss 1412,sackOK,TS val 2232612334 ecr 689114817,nop,wscale 8], length 0
15:31:15.716410 IP (tos 0x0, ttl 64, id 51708, offset 0, flags [DF], proto TCP (6), length 52)
    192.168.0.108.38350 > bom12s15-in-f3.1e100.net.https: Flags [.], cksum 0x8686 (correct), seq 1, ack 1, win 251, options [nop,nop,TS val 689114834 ecr 2232612334], length 0
15:31:15.722577 IP (tos 0x0, ttl 64, id 51709, offset 0, flags [DF], proto TCP (6), length 712)
    192.168.0.108.38350 > bom12s15-in-f3.1e100.net.https: Flags [P.], cksum 0x8b79 (correct), seq 1:661, ack 1, win 251, options [nop,nop,TS val 689114840 ecr 2232612334], length 660
15:31:15.748228 IP (tos 0x68, ttl 51, id 38677, offset 0, flags [DF], proto TCP (6), length 1476)
    20.207.73.82.https > 192.168.0.108.38194: Flags [.], cksum 0xa235 (correct), seq 4294965872:0, ack 1, win 69, options [nop,nop,TS val 2290136143 ecr 1910657306], length 1424
15:31:15.748366 IP (tos 0x0, ttl 64, id 50464, offset 0, flags [DF], proto TCP (6), length 52)
    192.168.0.108.38194 > 20.207.73.82.https: Flags [.], cksum 0x4d85 (correct), seq 1, ack 40647, win 3032, options [nop,nop,TS val 1910658621 ecr 2290136143], length 0
15:31:15.751477 IP (tos 0x0, ttl 64, id 50465, offset 0, flags [DF], proto TCP (6), length 99)
    192.168.0.108.38194 > 20.207.73.82.https: Flags [P.], cksum 0x15b1 (correct), seq 1:48, ack 40647, win 3336, options [nop,nop,TS val 1910658624 ecr 2290136143], length 47
15:31:15.757962 IP (tos 0x0, ttl 64, id 50466, offset 0, flags [DF], proto TCP (6), length 76)
    192.168.0.108.38194 > 20.207.73.82.https: Flags [FP.], cksum 0x7a54 (correct), seq 48:72, ack 40647, win 3336, options [nop,nop,TS val 1910658630 ecr 2290136143], length 24
15:31:15.808905 IP (tos 0x0, ttl 64, id 51710, offset 0, flags [DF], proto TCP (6), length 228)
    192.168.0.108.38350 > bom12s15-in-f3.1e100.net.https: Flags [P.], cksum 0x9b17 (correct), seq 661:837, ack 1, win 251, options [nop,nop,TS val 689114926 ecr 2232612334], length 176
15:31:15.813436 IP (tos 0x28, ttl 60, id 17379, offset 0, flags [none], proto TCP (6), length 52)
    bom12s15-in-f3.1e100.net.https > 192.168.0.108.38350: Flags [.], cksum 0x83c0 (correct), seq 1, ack 661, win 254, options [nop,nop,TS val 2232612375 ecr 689114840], length 0
15:31:15.822504 IP (tos 0x28, ttl 60, id 17380, offset 0, flags [none], proto TCP (6), length 820)
    bom12s15-in-f3.1e100.net.https > 192.168.0.108.38350: Flags [P.], cksum 0xb1db (correct), seq 1:769, ack 661, win 256, options [nop,nop,TS val 2232612436 ecr 689114840], length 768
15:31:15.822544 IP (tos 0x0, ttl 64, id 51711, offset 0, flags [DF], proto TCP (6), length 52)
    192.168.0.108.38350 > bom12s15-in-f3.1e100.net.https: Flags [.], cksum 0x7f74 (correct), seq 837, ack 769, win 249, options [nop,nop,TS val 689114940 ecr 2232612436], length 0
15:31:15.826617 IP (tos 0x28, ttl 60, id 17381, offset 0, flags [none], proto TCP (6), length 114)
    bom12s15-in-f3.1e100.net.https > 192.168.0.108.38350: Flags [P.], cksum 0xf027 (correct), seq 769:831, ack 661, win 256, options [nop,nop,TS val 2232612436 ecr 689114840], length 62
15:31:15.826671 IP (tos 0x0, ttl 64, id 51712, offset 0, flags [DF], proto TCP (6), length 136)
    192.168.0.108.38350 > bom12s15-in-f3.1e100.net.https: Flags [P.], cksum 0x78c8 (correct), seq 837:921, ack 831, win 249, options [nop,nop,TS val 689114944 ecr 2232612436], length 84
15:31:15.880309 IP (tos 0x28, ttl 60, id 17382, offset 0, flags [none], proto TCP (6), length 52)
    bom12s15-in-f3.1e100.net.https > 192.168.0.108.38350: Flags [.], cksum 0x7f01 (correct), seq 831, ack 837, win 256, options [nop,nop,TS val 2232612496 ecr 689114926], length 0
15:31:15.880388 IP (tos 0x0, ttl 64, id 51713, offset 0, flags [DF], proto TCP (6), length 83)
    192.168.0.108.38350 > bom12s15-in-f3.1e100.net.https: Flags [P.], cksum 0xda73 (correct), seq 921:952, ack 831, win 249, options [nop,nop,TS val 689114998 ecr 2232612496], length 31
15:31:15.885819 IP (tos 0x28, ttl 60, id 17383, offset 0, flags [none], proto TCP (6), length 83)
    bom12s15-in-f3.1e100.net.https > 192.168.0.108.38350: Flags [P.], cksum 0x9694 (correct), seq 831:862, ack 837, win 256, options [nop,nop,TS val 2232612496 ecr 689114940], length 31
15:31:15.889681 IP (tos 0x28, ttl 60, id 17384, offset 0, flags [none], proto TCP (6), length 52)
    bom12s15-in-f3.1e100.net.https > 192.168.0.108.38350: Flags [.], cksum 0x7e75 (correct), seq 862, ack 921, win 256, options [nop,nop,TS val 2232612503 ecr 689114944], length 0
15:31:15.903277 IP (tos 0x0, ttl 64, id 49716, offset 0, flags [DF], proto TCP (6), length 60)
    192.168.0.108.48928 > 20.207.73.82.https: Flags [S], cksum 0x31aa (correct), seq 3010870427, win 32120, options [mss 1460,sackOK,TS val 1910658776 ecr 0,nop,wscale 7], length 0
15:31:15.904417 IP (tos 0x28, ttl 60, id 17385, offset 0, flags [none], proto TCP (6), length 52)
    bom12s15-in-f3.1e100.net.https > 192.168.0.108.38350: Flags [.], cksum 0x7e11 (correct), seq 862, ack 952, win 256, options [nop,nop,TS val 2232612518 ecr 689114998], length 0
15:31:15.905814 IP (tos 0x68, ttl 51, id 38678, offset 0, flags [DF], proto TCP (6), length 52)
    20.207.73.82.https > 192.168.0.108.38194: Flags [.], cksum 0x5822 (correct), seq 40647, ack 73, win 69, options [nop,nop,TS val 2290136314 ecr 1910658624], length 0
15:31:15.907409 IP (tos 0x68, ttl 51, id 38679, offset 0, flags [DF], proto TCP (6), length 76)
    20.207.73.82.https > 192.168.0.108.38194: Flags [P.], cksum 0xb0b1 (correct), seq 40647:40671, ack 73, win 69, options [nop,nop,TS val 2290136314 ecr 1910658624], length 24
15:31:15.907485 IP (tos 0x68, ttl 64, id 0, offset 0, flags [DF], proto TCP (6), length 40)
    192.168.0.108.38194 > 20.207.73.82.https: Flags [R], cksum 0x2e58 (correct), seq 1544056669, win 0, length 0
15:31:15.911946 IP (tos 0x68, ttl 51, id 38680, offset 0, flags [DF], proto TCP (6), length 52)
    20.207.73.82.https > 192.168.0.108.38194: Flags [F.], cksum 0x5809 (correct), seq 40671, ack 73, win 69, options [nop,nop,TS val 2290136314 ecr 1910658624], length 0
15:31:15.912016 IP (tos 0x68, ttl 64, id 0, offset 0, flags [DF], proto TCP (6), length 40)
    192.168.0.108.38194 > 20.207.73.82.https: Flags [R], cksum 0x2e58 (correct), seq 1544056669, win 0, length 0
15:31:15.929365 IP (tos 0x0, ttl 64, id 51714, offset 0, flags [DF], proto TCP (6), length 52)
    192.168.0.108.38350 > bom12s15-in-f3.1e100.net.https: Flags [.], cksum 0x7dfd (correct), seq 952, ack 862, win 249, options [nop,nop,TS val 689115047 ecr 2232612496], length 0
15:31:15.944872 IP (tos 0x68, ttl 51, id 0, offset 0, flags [DF], proto TCP (6), length 60)
    20.207.73.82.https > 192.168.0.108.48928: Flags [S.], cksum 0x3f7f (correct), seq 2525297539, ack 3010870428, win 65535, options [mss 1436,sackOK,TS val 840280969 ecr 1910658776,nop,wscale 10], length 0
15:31:15.944947 IP (tos 0x0, ttl 64, id 49717, offset 0, flags [DF], proto TCP (6), length 52)
    192.168.0.108.48928 > 20.207.73.82.https: Flags [.], cksum 0x6d12 (correct), seq 1, ack 1, win 251, options [nop,nop,TS val 1910658817 ecr 840280969], length 0
15:31:15.946231 IP (tos 0x0, ttl 64, id 49718, offset 0, flags [DF], proto TCP (6), length 451)
    192.168.0.108.48928 > 20.207.73.82.https: Flags [P.], cksum 0x121e (correct), seq 1:400, ack 1, win 251, options [nop,nop,TS val 1910658818 ecr 840280969], length 399
15:31:15.966382 IP (tos 0x68, ttl 51, id 40150, offset 0, flags [DF], proto TCP (6), length 1476)
    20.207.73.82.https > 192.168.0.108.48928: Flags [.], cksum 0xb63b (correct), seq 1:1425, ack 400, win 66, options [nop,nop,TS val 840280979 ecr 1910658818], length 1424
15:31:15.966455 IP (tos 0x0, ttl 64, id 49719, offset 0, flags [DF], proto TCP (6), length 52)
    192.168.0.108.48928 > 20.207.73.82.https: Flags [.], cksum 0x65d5 (correct), seq 400, ack 1425, win 249, options [nop,nop,TS val 1910658839 ecr 840280979], length 0
15:31:16.006519 IP (tos 0x68, ttl 51, id 40151, offset 0, flags [DF], proto TCP (6), length 1476)
    20.207.73.82.https > 192.168.0.108.48928: Flags [P.], cksum 0xf5b5 (correct), seq 1425:2849, ack 400, win 66, options [nop,nop,TS val 840280979 ecr 1910658818], length 1424
15:31:16.006577 IP (tos 0x0, ttl 64, id 49720, offset 0, flags [DF], proto TCP (6), length 52)
    192.168.0.108.48928 > 20.207.73.82.https: Flags [.], cksum 0x601d (correct), seq 400, ack 2849, win 249, options [nop,nop,TS val 1910658879 ecr 840280979], length 0
15:31:16.013422 IP (tos 0x68, ttl 51, id 40152, offset 0, flags [DF], proto TCP (6), length 738)
    20.207.73.82.https > 192.168.0.108.48928: Flags [P.], cksum 0xc7d2 (correct), seq 2849:3535, ack 400, win 66, options [nop,nop,TS val 840280979 ecr 1910658818], length 686
15:31:16.013454 IP (tos 0x0, ttl 64, id 49721, offset 0, flags [DF], proto TCP (6), length 52)
    192.168.0.108.48928 > 20.207.73.82.https: Flags [.], cksum 0x5d68 (correct), seq 400, ack 3535, win 249, options [nop,nop,TS val 1910658886 ecr 840280979], length 0
15:31:16.027249 IP (tos 0x68, ttl 51, id 40153, offset 0, flags [DF], proto TCP (6), length 738)
    20.207.73.82.https > 192.168.0.108.48928: Flags [P.], cksum 0xc7b2 (correct), seq 2849:3535, ack 400, win 66, options [nop,nop,TS val 840281011 ecr 1910658818], length 686
15:31:16.027290 IP (tos 0x0, ttl 64, id 49722, offset 0, flags [DF], proto TCP (6), length 64)
    192.168.0.108.48928 > 20.207.73.82.https: Flags [.], cksum 0xea21 (correct), seq 400, ack 3535, win 249, options [nop,nop,TS val 1910658900 ecr 840281011,nop,nop,sack 1 {2849:3535}], length 0
15:31:16.063658 IP (tos 0x0, ttl 64, id 49723, offset 0, flags [DF], proto TCP (6), length 58)
    192.168.0.108.48928 > 20.207.73.82.https: Flags [P.], cksum 0x4504 (correct), seq 400:406, ack 3535, win 249, options [nop,nop,TS val 1910658936 ecr 840281011], length 6
15:31:16.064473 IP (tos 0x0, ttl 64, id 49724, offset 0, flags [DF], proto TCP (6), length 110)
    192.168.0.108.48928 > 20.207.73.82.https: Flags [P.], cksum 0x04b6 (correct), seq 406:464, ack 3535, win 249, options [nop,nop,TS val 1910658937 ecr 840281011], length 58
15:31:16.069045 IP (tos 0x0, ttl 64, id 49725, offset 0, flags [DF], proto TCP (6), length 138)
    192.168.0.108.48928 > 20.207.73.82.https: Flags [P.], cksum 0x6843 (correct), seq 464:550, ack 3535, win 249, options [nop,nop,TS val 1910658941 ecr 840281011], length 86
15:31:16.069140 IP (tos 0x0, ttl 64, id 49726, offset 0, flags [DF], proto TCP (6), length 211)
    192.168.0.108.48928 > 20.207.73.82.https: Flags [P.], cksum 0x8f94 (correct), seq 550:709, ack 3535, win 249, options [nop,nop,TS val 1910658941 ecr 840281011], length 159
15:31:16.079830 IP (tos 0x68, ttl 51, id 40154, offset 0, flags [DF], proto TCP (6), length 52)
    20.207.73.82.https > 192.168.0.108.48928: Flags [.], cksum 0x5d37 (correct), seq 3535, ack 464, win 66, options [nop,nop,TS val 840281097 ecr 1910658936], length 0
15:31:16.085973 IP (tos 0x68, ttl 51, id 40155, offset 0, flags [DF], proto TCP (6), length 131)
    20.207.73.82.https > 192.168.0.108.48928: Flags [P.], cksum 0x3c77 (correct), seq 3535:3614, ack 464, win 66, options [nop,nop,TS val 840281097 ecr 1910658936], length 79
15:31:16.086091 IP (tos 0x0, ttl 64, id 49727, offset 0, flags [DF], proto TCP (6), length 52)
    192.168.0.108.48928 > 20.207.73.82.https: Flags [.], cksum 0x5b26 (correct), seq 709, ack 3614, win 249, options [nop,nop,TS val 1910658958 ecr 840281097], length 0
15:31:16.090235 IP (tos 0x68, ttl 51, id 40156, offset 0, flags [DF], proto TCP (6), length 131)
    20.207.73.82.https > 192.168.0.108.48928: Flags [P.], cksum 0xf191 (correct), seq 3614:3693, ack 464, win 66, options [nop,nop,TS val 840281097 ecr 1910658936], length 79
15:31:16.090344 IP (tos 0x0, ttl 64, id 49728, offset 0, flags [DF], proto TCP (6), length 52)
    192.168.0.108.48928 > 20.207.73.82.https: Flags [.], cksum 0x5ad2 (correct), seq 709, ack 3693, win 249, options [nop,nop,TS val 1910658963 ecr 840281097], length 0
15:31:16.094309 IP (tos 0x68, ttl 51, id 40157, offset 0, flags [DF], proto TCP (6), length 116)
    20.207.73.82.https > 192.168.0.108.48928: Flags [P.], cksum 0x8f92 (correct), seq 3693:3757, ack 550, win 66, options [nop,nop,TS val 840281100 ecr 1910658941], length 64
15:31:16.094426 IP (tos 0x0, ttl 64, id 49729, offset 0, flags [DF], proto TCP (6), length 52)
    192.168.0.108.48928 > 20.207.73.82.https: Flags [.], cksum 0x5a8b (correct), seq 709, ack 3757, win 249, options [nop,nop,TS val 1910658967 ecr 840281100], length 0
15:31:16.094647 IP (tos 0x0, ttl 64, id 49730, offset 0, flags [DF], proto TCP (6), length 83)
    192.168.0.108.48928 > 20.207.73.82.https: Flags [P.], cksum 0xb7a3 (correct), seq 709:740, ack 3757, win 249, options [nop,nop,TS val 1910658967 ecr 840281100], length 31
15:31:16.104023 IP (tos 0x68, ttl 51, id 40158, offset 0, flags [DF], proto TCP (6), length 52)
    20.207.73.82.https > 192.168.0.108.48928: Flags [.], cksum 0x5b20 (correct), seq 3757, ack 740, win 67, options [nop,nop,TS val 840281128 ecr 1910658941], length 0
15:31:16.312594 IP (tos 0x68, ttl 51, id 40159, offset 0, flags [DF], proto TCP (6), length 615)
    20.207.73.82.https > 192.168.0.108.48928: Flags [P.], cksum 0xd261 (correct), seq 3757:4320, ack 740, win 67, options [nop,nop,TS val 840281321 ecr 1910658941], length 563
15:31:16.314850 IP (tos 0x0, ttl 64, id 49731, offset 0, flags [DF], proto TCP (6), length 362)
    192.168.0.108.48928 > 20.207.73.82.https: Flags [P.], cksum 0x95bb (correct), seq 740:1050, ack 4320, win 249, options [nop,nop,TS val 1910659187 ecr 840281321], length 310
15:31:16.326524 IP (tos 0x68, ttl 51, id 40160, offset 0, flags [DF], proto TCP (6), length 100)
    20.207.73.82.https > 192.168.0.108.48928: Flags [P.], cksum 0xd266 (correct), seq 4320:4368, ack 1050, win 68, options [nop,nop,TS val 840281348 ecr 1910659187], length 48
15:31:16.369322 IP (tos 0x0, ttl 64, id 49732, offset 0, flags [DF], proto TCP (6), length 52)
    192.168.0.108.48928 > 20.207.73.82.https: Flags [.], cksum 0x54c8 (correct), seq 1050, ack 4368, win 249, options [nop,nop,TS val 1910659242 ecr 840281348], length 0
15:31:16.541845 IP (tos 0x68, ttl 51, id 40161, offset 0, flags [DF], proto TCP (6), length 405)
    20.207.73.82.https > 192.168.0.108.48928: Flags [P.], cksum 0xc249 (correct), seq 4368:4721, ack 1050, win 68, options [nop,nop,TS val 840281564 ecr 1910659242], length 353
15:31:16.541961 IP (tos 0x0, ttl 64, id 49733, offset 0, flags [DF], proto TCP (6), length 52)
    192.168.0.108.48928 > 20.207.73.82.https: Flags [.], cksum 0x51e3 (correct), seq 1050, ack 4721, win 249, options [nop,nop,TS val 1910659414 ecr 840281564], length 0
15:31:16.582582 IP (tos 0x68, ttl 51, id 40162, offset 0, flags [DF], proto TCP (6), length 1476)
    20.207.73.82.https > 192.168.0.108.48928: Flags [.], cksum 0xd990 (correct), seq 4721:6145, ack 1050, win 68, options [nop,nop,TS val 840281564 ecr 1910659242], length 1424
15:31:16.582681 IP (tos 0x0, ttl 64, id 49734, offset 0, flags [DF], proto TCP (6), length 52)
    192.168.0.108.48928 > 20.207.73.82.https: Flags [.], cksum 0x4c2a (correct), seq 1050, ack 6145, win 249, options [nop,nop,TS val 1910659455 ecr 840281564], length 0
15:31:16.584158 IP (tos 0x68, ttl 51, id 40163, offset 0, flags [DF], proto TCP (6), length 69)
    20.207.73.82.https > 192.168.0.108.48928: Flags [P.], cksum 0x5e88 (correct), seq 6145:6162, ack 1050, win 68, options [nop,nop,TS val 840281564 ecr 1910659242], length 17
15:31:16.584216 IP (tos 0x0, ttl 64, id 49735, offset 0, flags [DF], proto TCP (6), length 52)
    192.168.0.108.48928 > 20.207.73.82.https: Flags [.], cksum 0x4c18 (correct), seq 1050, ack 6162, win 249, options [nop,nop,TS val 1910659456 ecr 840281564], length 0
15:31:16.589554 IP (tos 0x0, ttl 64, id 49736, offset 0, flags [DF], proto TCP (6), length 743)
    192.168.0.108.48928 > 20.207.73.82.https: Flags [P.], cksum 0x74c4 (correct), seq 1050:1741, ack 6162, win 249, options [nop,nop,TS val 1910659462 ecr 840281564], length 691
15:31:16.626221 IP (tos 0x68, ttl 51, id 40164, offset 0, flags [DF], proto TCP (6), length 100)
    20.207.73.82.https > 192.168.0.108.48928: Flags [P.], cksum 0xae24 (correct), seq 6162:6210, ack 1741, win 69, options [nop,nop,TS val 840281651 ecr 1910659462], length 48
15:31:16.669361 IP (tos 0x0, ttl 64, id 49737, offset 0, flags [DF], proto TCP (6), length 52)
    192.168.0.108.48928 > 20.207.73.82.https: Flags [.], cksum 0x4888 (correct), seq 1741, ack 6210, win 249, options [nop,nop,TS val 1910659542 ecr 840281651], length 0
15:31:16.671391 IP (tos 0x0, ttl 64, id 15072, offset 0, flags [DF], proto TCP (6), length 91)
    192.168.0.108.33276 > 166.188.117.34.bc.googleusercontent.com.https: Flags [P.], cksum 0x2d05 (correct), seq 720027174:720027213, ack 507743462, win 249, options [nop,nop,TS val 185541034 ecr 1704091363], length 39
15:31:16.705932 IP (tos 0x28, ttl 60, id 22092, offset 0, flags [none], proto TCP (6), length 91)
    166.188.117.34.bc.googleusercontent.com.https > 192.168.0.108.33276: Flags [P.], cksum 0xc5cb (correct), seq 1:40, ack 39, win 265, options [nop,nop,TS val 1704149626 ecr 185541034], length 39
15:31:16.706026 IP (tos 0x0, ttl 64, id 15073, offset 0, flags [DF], proto TCP (6), length 52)
    192.168.0.108.33276 > 166.188.117.34.bc.googleusercontent.com.https: Flags [.], cksum 0xe86b (correct), seq 39, ack 40, win 249, options [nop,nop,TS val 185541068 ecr 1704149626], length 0
15:31:16.882417 IP (tos 0x68, ttl 51, id 40165, offset 0, flags [DF], proto TCP (6), length 1476)
    20.207.73.82.https > 192.168.0.108.48928: Flags [.], cksum 0x88b2 (correct), seq 6210:7634, ack 1741, win 69, options [nop,nop,TS val 840281883 ecr 1910659542], length 1424
15:31:16.882536 IP (tos 0x0, ttl 64, id 49738, offset 0, flags [DF], proto TCP (6), length 52)
    192.168.0.108.48928 > 20.207.73.82.https: Flags [.], cksum 0x413b (correct), seq 1741, ack 7634, win 249, options [nop,nop,TS val 1910659755 ecr 840281883], length 0
15:31:16.895766 IP (tos 0x68, ttl 51, id 40166, offset 0, flags [DF], proto TCP (6), length 573)
    20.207.73.82.https > 192.168.0.108.48928: Flags [P.], cksum 0xd5fa (correct), seq 7634:8155, ack 1741, win 69, options [nop,nop,TS val 840281883 ecr 1910659542], length 521
15:31:16.895864 IP (tos 0x0, ttl 64, id 49739, offset 0, flags [DF], proto TCP (6), length 52)
    192.168.0.108.48928 > 20.207.73.82.https: Flags [.], cksum 0x3f25 (correct), seq 1741, ack 8155, win 249, options [nop,nop,TS val 1910659768 ecr 840281883], length 0
15:31:16.909047 IP (tos 0x68, ttl 51, id 40167, offset 0, flags [DF], proto TCP (6), length 1476)
    20.207.73.82.https > 192.168.0.108.48928: Flags [.], cksum 0x2e5a (correct), seq 8155:9579, ack 1741, win 69, options [nop,nop,TS val 840281883 ecr 1910659542], length 1424
15:31:16.909109 IP (tos 0x0, ttl 64, id 49740, offset 0, flags [DF], proto TCP (6), length 52)
    192.168.0.108.48928 > 20.207.73.82.https: Flags [.], cksum 0x3988 (correct), seq 1741, ack 9579, win 249, options [nop,nop,TS val 1910659781 ecr 840281883], length 0
15:31:16.925469 IP (tos 0x68, ttl 51, id 40168, offset 0, flags [DF], proto TCP (6), length 383)
    20.207.73.82.https > 192.168.0.108.48928: Flags [P.], cksum 0xb66a (correct), seq 9579:9910, ack 1741, win 69, options [nop,nop,TS val 840281883 ecr 1910659542], length 331
15:31:16.925526 IP (tos 0x0, ttl 64, id 49741, offset 0, flags [DF], proto TCP (6), length 52)
    192.168.0.108.48928 > 20.207.73.82.https: Flags [.], cksum 0x382c (correct), seq 1741, ack 9910, win 249, options [nop,nop,TS val 1910659798 ecr 840281883], length 0
15:31:16.936146 IP (tos 0x68, ttl 51, id 40169, offset 0, flags [DF], proto TCP (6), length 1192)
    20.207.73.82.https > 192.168.0.108.48928: Flags [P.], cksum 0x0dc1 (correct), seq 9910:11050, ack 1741, win 69, options [nop,nop,TS val 840281894 ecr 1910659542], length 1140
15:31:16.936252 IP (tos 0x0, ttl 64, id 49742, offset 0, flags [DF], proto TCP (6), length 52)
    192.168.0.108.48928 > 20.207.73.82.https: Flags [.], cksum 0x33a3 (correct), seq 1741, ack 11050, win 249, options [nop,nop,TS val 1910659808 ecr 840281894], length 0
15:31:16.946115 IP (tos 0x68, ttl 51, id 40170, offset 0, flags [DF], proto TCP (6), length 1123)
    20.207.73.82.https > 192.168.0.108.48928: Flags [P.], cksum 0xab82 (correct), seq 11050:12121, ack 1741, win 69, options [nop,nop,TS val 840281895 ecr 1910659542], length 1071
15:31:16.946231 IP (tos 0x0, ttl 64, id 49743, offset 0, flags [DF], proto TCP (6), length 52)
    192.168.0.108.48928 > 20.207.73.82.https: Flags [.], cksum 0x2f69 (correct), seq 1741, ack 12121, win 249, options [nop,nop,TS val 1910659818 ecr 840281895], length 0
15:31:16.957516 IP (tos 0x68, ttl 51, id 40171, offset 0, flags [DF], proto TCP (6), length 1193)
    20.207.73.82.https > 192.168.0.108.48928: Flags [P.], cksum 0x427b (correct), seq 12121:13262, ack 1741, win 69, options [nop,nop,TS val 840281896 ecr 1910659542], length 1141
15:31:16.957596 IP (tos 0x0, ttl 64, id 49744, offset 0, flags [DF], proto TCP (6), length 52)
    192.168.0.108.48928 > 20.207.73.82.https: Flags [.], cksum 0x2ae7 (correct), seq 1741, ack 13262, win 249, options [nop,nop,TS val 1910659830 ecr 840281896], length 0
15:31:16.967148 IP (tos 0x68, ttl 51, id 40172, offset 0, flags [DF], proto TCP (6), length 1006)
    20.207.73.82.https > 192.168.0.108.48928: Flags [P.], cksum 0x7ba6 (correct), seq 13262:14216, ack 1741, win 69, options [nop,nop,TS val 840281897 ecr 1910659542], length 954
15:31:16.967255 IP (tos 0x0, ttl 64, id 49745, offset 0, flags [DF], proto TCP (6), length 52)
    192.168.0.108.48928 > 20.207.73.82.https: Flags [.], cksum 0x2723 (correct), seq 1741, ack 14216, win 249, options [nop,nop,TS val 1910659839 ecr 840281897], length 0
15:31:16.979957 IP (tos 0x68, ttl 51, id 40173, offset 0, flags [DF], proto TCP (6), length 1476)
    20.207.73.82.https > 192.168.0.108.48928: Flags [.], cksum 0xb93f (correct), seq 14216:15640, ack 1741, win 69, options [nop,nop,TS val 840281897 ecr 1910659542], length 1424
